{
  "$schema": "https://json-schema.org/draft/2020-12/schema",
  "$id": "https://github.com/fallblu/trading-engine/schemas/scenario.schema.json",
  "title": "Trading Engine replay scenario",
  "description": "The strict structural input contract. The engine additionally checks catalog coverage, ordering, causality, risk, tick, lot, time, and OHLC invariants.",
  "type": "object",
  "additionalProperties": false,
  "required": [
    "metadata",
    "run_id",
    "base_currency",
    "initial_cash",
    "instruments",
    "risk",
    "execution",
    "max_internal_events",
    "schedule",
    "slices"
  ],
  "properties": {
    "metadata": { "type": "object" },
    "run_id": { "$ref": "#/$defs/identifier" },
    "base_currency": { "$ref": "#/$defs/identifier" },
    "initial_cash": { "$ref": "#/$defs/unsignedDecimal" },
    "instruments": {
      "type": "array",
      "minItems": 1,
      "items": { "$ref": "#/$defs/instrument" }
    },
    "risk": { "$ref": "#/$defs/risk" },
    "execution": { "$ref": "#/$defs/execution" },
    "max_internal_events": { "type": "integer", "minimum": 1 },
    "schedule": {
      "type": "array",
      "items": { "$ref": "#/$defs/scheduleItem" }
    },
    "slices": {
      "type": "array",
      "items": { "$ref": "#/$defs/marketSlice" }
    }
  },
  "$defs": {
    "identifier": {
      "type": "string",
      "minLength": 1,
      "pattern": "^[^\\s\\u0000-\\u001f\\u007f]+$"
    },
    "unsignedDecimal": {
      "type": "string",
      "pattern": "^(?:0|[1-9][0-9]*)(?:[.][0-9]{0,5}[1-9])?$"
    },
    "positiveDecimal": {
      "type": "string",
      "pattern": "^(?:0[.][0-9]{0,5}[1-9]|[1-9][0-9]*(?:[.][0-9]{0,5}[1-9])?)$"
    },
    "weight": {
      "type": "string",
      "pattern": "^(?:0(?:[.][0-9]{0,5}[1-9])?|1)$"
    },
    "quantity": {
      "type": "string",
      "pattern": "^(?:0|[1-9][0-9]*)$"
    },
    "positiveQuantity": {
      "type": "string",
      "pattern": "^[1-9][0-9]*$"
    },
    "sequence": {
      "type": "string",
      "pattern": "^[1-9][0-9]*$"
    },
    "timestamp": {
      "type": "string",
      "format": "date-time",
      "pattern": "^(?:[^.]*|[^.]*[.][0-9]{1,6}(?:[zZ]|[+-][0-9]{2}:[0-9]{2}))$"
    },
    "instrument": {
      "type": "object",
      "additionalProperties": false,
      "required": [
        "instrument_id",
        "symbol",
        "quote_currency",
        "tick_size",
        "lot_size"
      ],
      "properties": {
        "instrument_id": { "$ref": "#/$defs/identifier" },
        "symbol": { "$ref": "#/$defs/identifier" },
        "quote_currency": { "$ref": "#/$defs/identifier" },
        "tick_size": { "$ref": "#/$defs/positiveDecimal" },
        "lot_size": { "$ref": "#/$defs/positiveQuantity" }
      }
    },
    "risk": {
      "type": "object",
      "additionalProperties": false,
      "required": ["max_order_quantity", "max_position"],
      "properties": {
        "max_order_quantity": { "$ref": "#/$defs/positiveQuantity" },
        "max_position": { "$ref": "#/$defs/positiveQuantity" }
      }
    },
    "execution": {
      "type": "object",
      "additionalProperties": false,
      "required": ["participation_bps", "fixed_fee", "fee_bps"],
      "properties": {
        "participation_bps": {
          "type": "integer",
          "minimum": 0,
          "maximum": 10000
        },
        "fixed_fee": { "$ref": "#/$defs/unsignedDecimal" },
        "fee_bps": { "type": "integer", "minimum": 0, "maximum": 10000 }
      }
    },
    "scheduleItem": {
      "type": "object",
      "additionalProperties": false,
      "required": ["after_slice_sequence", "intents"],
      "properties": {
        "after_slice_sequence": { "$ref": "#/$defs/sequence" },
        "intents": {
          "type": "array",
          "items": { "$ref": "#/$defs/intent" }
        }
      }
    },
    "intent": {
      "oneOf": [
        { "$ref": "#/$defs/targetWeightsIntent" },
        { "$ref": "#/$defs/targetQuantitiesIntent" },
        { "$ref": "#/$defs/marketOrderIntent" },
        { "$ref": "#/$defs/limitOrderIntent" },
        { "$ref": "#/$defs/cancelOrderIntent" },
        { "$ref": "#/$defs/metricIntent" }
      ]
    },
    "targetWeightsIntent": {
      "type": "object",
      "additionalProperties": false,
      "required": ["type", "targets"],
      "properties": {
        "type": { "const": "target_weights" },
        "targets": {
          "type": "array",
          "minItems": 1,
          "items": { "$ref": "#/$defs/weightTarget" }
        }
      }
    },
    "weightTarget": {
      "type": "object",
      "additionalProperties": false,
      "required": ["instrument_id", "weight"],
      "properties": {
        "instrument_id": { "$ref": "#/$defs/identifier" },
        "weight": { "$ref": "#/$defs/weight" }
      }
    },
    "targetQuantitiesIntent": {
      "type": "object",
      "additionalProperties": false,
      "required": ["type", "targets"],
      "properties": {
        "type": { "const": "target_quantities" },
        "targets": {
          "type": "array",
          "minItems": 1,
          "items": { "$ref": "#/$defs/quantityTarget" }
        }
      }
    },
    "quantityTarget": {
      "type": "object",
      "additionalProperties": false,
      "required": ["instrument_id", "quantity"],
      "properties": {
        "instrument_id": { "$ref": "#/$defs/identifier" },
        "quantity": { "$ref": "#/$defs/quantity" }
      }
    },
    "orderFields": {
      "type": "object",
      "required": [
        "type",
        "instrument_id",
        "side",
        "quantity",
        "order_kind",
        "limit_price"
      ],
      "properties": {
        "type": { "const": "submit_order" },
        "instrument_id": { "$ref": "#/$defs/identifier" },
        "side": { "enum": ["buy", "sell"] },
        "quantity": { "$ref": "#/$defs/positiveQuantity" }
      }
    },
    "marketOrderIntent": {
      "allOf": [
        { "$ref": "#/$defs/orderFields" },
        {
          "type": "object",
          "additionalProperties": false,
          "required": [
            "type",
            "instrument_id",
            "side",
            "quantity",
            "order_kind",
            "limit_price"
          ],
          "properties": {
            "type": true,
            "instrument_id": true,
            "side": true,
            "quantity": true,
            "order_kind": { "const": "market" },
            "limit_price": { "type": "null" }
          }
        }
      ]
    },
    "limitOrderIntent": {
      "allOf": [
        { "$ref": "#/$defs/orderFields" },
        {
          "type": "object",
          "additionalProperties": false,
          "required": [
            "type",
            "instrument_id",
            "side",
            "quantity",
            "order_kind",
            "limit_price"
          ],
          "properties": {
            "type": true,
            "instrument_id": true,
            "side": true,
            "quantity": true,
            "order_kind": { "const": "limit" },
            "limit_price": { "$ref": "#/$defs/positiveDecimal" }
          }
        }
      ]
    },
    "cancelOrderIntent": {
      "type": "object",
      "additionalProperties": false,
      "required": ["type", "order_id"],
      "properties": {
        "type": { "const": "cancel_order" },
        "order_id": { "$ref": "#/$defs/identifier" }
      }
    },
    "metricIntent": {
      "type": "object",
      "additionalProperties": false,
      "required": ["type", "name", "value"],
      "properties": {
        "type": { "const": "emit_metric" },
        "name": { "type": "string" },
        "value": { "type": "string" }
      }
    },
    "marketSlice": {
      "type": "object",
      "additionalProperties": false,
      "required": [
        "slice_sequence",
        "start_at",
        "end_at",
        "available_at",
        "received_at",
        "bars"
      ],
      "properties": {
        "slice_sequence": { "$ref": "#/$defs/sequence" },
        "start_at": { "$ref": "#/$defs/timestamp" },
        "end_at": { "$ref": "#/$defs/timestamp" },
        "available_at": { "$ref": "#/$defs/timestamp" },
        "received_at": { "$ref": "#/$defs/timestamp" },
        "bars": {
          "type": "array",
          "minItems": 1,
          "items": { "$ref": "#/$defs/bar" }
        }
      }
    },
    "bar": {
      "type": "object",
      "additionalProperties": false,
      "required": ["instrument_id", "open", "high", "low", "close", "volume"],
      "properties": {
        "instrument_id": { "$ref": "#/$defs/identifier" },
        "open": { "$ref": "#/$defs/positiveDecimal" },
        "high": { "$ref": "#/$defs/positiveDecimal" },
        "low": { "$ref": "#/$defs/positiveDecimal" },
        "close": { "$ref": "#/$defs/positiveDecimal" },
        "volume": {
          "oneOf": [
            { "$ref": "#/$defs/quantity" },
            { "type": "null" }
          ]
        }
      }
    }
  }
}
